{
  "$schema": "https://json-schema.org/draft/2020-12/schema",
  "$id": "https://github.com/subunit-ai/scai-releases/fleet/manifest.schema.json",
  "title": "SCAI Fleet Release Manifest",
  "type": "object",
  "additionalProperties": false,
  "required": [
    "schema_version",
    "release_id",
    "status",
    "created_at",
    "pins",
    "gates",
    "market_gates",
    "market_evidence",
    "source_ci",
    "artifacts",
    "governance",
    "operations",
    "approvals",
    "blockers"
  ],
  "properties": {
    "$schema": { "type": "string" },
    "schema_version": { "const": "1.2" },
    "release_id": { "type": "string", "pattern": "^scai-candidate-[0-9]{4}-[0-9]{2}-[0-9]{2}\\.[0-9]+$" },
    "status": { "enum": ["candidate", "pass", "rejected", "superseded"] },
    "created_at": { "type": "string", "format": "date-time" },
    "authorized_release": { "$ref": "#/$defs/authorizedRelease" },
    "supersession": { "$ref": "#/$defs/supersession" },
    "pins": {
      "type": "object",
      "minProperties": 6,
      "additionalProperties": { "$ref": "#/$defs/pin" }
    },
    "gates": {
      "type": "object",
      "additionalProperties": false,
      "required": ["A1", "A2", "A3", "A4", "A5", "A6", "A7", "A8"],
      "properties": {
        "A1": { "$ref": "#/$defs/gate" },
        "A2": { "$ref": "#/$defs/gate" },
        "A3": { "$ref": "#/$defs/gate" },
        "A4": { "$ref": "#/$defs/gate" },
        "A5": { "$ref": "#/$defs/gate" },
        "A6": { "$ref": "#/$defs/gate" },
        "A7": { "$ref": "#/$defs/gate" },
        "A8": { "$ref": "#/$defs/gate" }
      }
    },
    "market_gates": {
      "type": "object",
      "additionalProperties": false,
      "required": ["R0", "R1", "R2", "R3"],
      "properties": {
        "R0": { "$ref": "#/$defs/marketGate" },
        "R1": { "$ref": "#/$defs/marketGate" },
        "R2": { "$ref": "#/$defs/marketGate" },
        "R3": { "$ref": "#/$defs/marketGate" }
      }
    },
    "market_evidence": { "$ref": "#/$defs/marketEvidence" },
    "source_ci": { "$ref": "#/$defs/sourceCi" },
    "artifacts": { "$ref": "#/$defs/artifacts" },
    "governance": { "$ref": "#/$defs/governance" },
    "operations": { "$ref": "#/$defs/operations" },
    "approvals": { "$ref": "#/$defs/approvals" },
    "blockers": {
      "type": "array",
      "items": { "$ref": "#/$defs/blocker" }
    }
  },
  "allOf": [
    {
      "if": { "properties": { "status": { "const": "pass" } } },
      "then": { "required": ["authorized_release"] }
    },
    {
      "if": { "properties": { "status": { "const": "superseded" } } },
      "then": { "required": ["supersession"] },
      "else": { "not": { "required": ["supersession"] } }
    }
  ],
  "$defs": {
    "authorizedRelease": {
      "type": "object",
      "additionalProperties": false,
      "required": ["repository", "tag", "distribution_policy", "assets"],
      "properties": {
        "repository": { "const": "subunit-ai/scai-releases" },
        "tag": { "type": "string", "pattern": "^v[0-9A-Za-z.+-]+$" },
        "distribution_policy": { "enum": ["market-ready", "legacy-v0.125"] },
        "assets": {
          "type": "array", "minItems": 26, "maxItems": 26,
          "items": {
            "type": "object", "additionalProperties": false,
            "required": ["name", "url", "sha256"],
            "properties": {
              "name": { "type": "string", "minLength": 1, "maxLength": 200 },
              "url": { "type": "string", "format": "uri" },
              "sha256": { "type": "string", "pattern": "^[0-9a-f]{64}$" }
            }
          }
        }
      }
    },
    "sha": { "type": "string", "pattern": "^[0-9a-f]{40}$" },
    "uriOrEmpty": { "type": "string", "pattern": "^(https://|$)" },
    "pin": {
      "type": "object",
      "additionalProperties": false,
      "required": ["repository", "sha", "branch", "pr_url", "merge_status"],
      "properties": {
        "repository": { "type": "string", "pattern": "^https://github.com/subunit-ai/[A-Za-z0-9._-]+$" },
        "sha": { "$ref": "#/$defs/sha" },
        "branch": { "type": "string", "minLength": 1 },
        "pr_url": { "$ref": "#/$defs/uriOrEmpty" },
        "merge_status": { "enum": ["open", "merged", "rejected"] }
      }
    },
    "gate": {
      "type": "object",
      "additionalProperties": false,
      "required": ["title", "release_pin", "status", "owner", "judge", "evidence", "acceptance"],
      "properties": {
        "title": { "type": "string", "minLength": 1 },
        "release_pin": { "type": "string", "minLength": 1 },
        "status": { "enum": ["open", "candidate", "pass", "failed"] },
        "owner": { "type": "string" },
        "judge": { "type": "string" },
        "evidence": { "type": "array", "items": { "type": "string", "minLength": 1 } },
        "acceptance": { "type": "string", "minLength": 1 }
      }
    },
    "marketGate": {
      "type": "object",
      "additionalProperties": false,
      "required": ["title", "status", "owner", "evidence", "acceptance"],
      "properties": {
        "title": { "type": "string", "minLength": 1 },
        "status": { "enum": ["open", "pass", "failed"] },
        "owner": { "type": "string" },
        "evidence": { "type": "array", "items": { "type": "string", "minLength": 1 } },
        "acceptance": { "type": "string", "minLength": 1 }
      }
    },
    "marketEvidence": {
      "type": "object",
      "additionalProperties": false,
      "required": ["status", "release_pin", "source_sha", "report_schema_version", "report_url", "report_sha256", "validator_name", "validator_role", "validated_at", "attestation_url", "attestation_sha256", "repeatable_paying_customers"],
      "properties": {
        "status": { "enum": ["open", "pass", "failed"] },
        "release_pin": { "type": "string", "minLength": 1 },
        "source_sha": { "$ref": "#/$defs/sha" },
        "report_schema_version": { "const": "1.0" },
        "report_url": { "$ref": "#/$defs/uriOrEmpty" },
        "report_sha256": { "type": "string", "pattern": "^([0-9a-f]{64})?$" },
        "validator_name": { "type": "string" },
        "validator_role": { "type": "string" },
        "validated_at": { "type": "string" },
        "attestation_url": { "$ref": "#/$defs/uriOrEmpty" },
        "attestation_sha256": { "type": "string", "pattern": "^([0-9a-f]{64})?$" },
        "repeatable_paying_customers": { "type": "integer", "minimum": 0 }
      }
    },
    "sourceCi": {
      "type": "object",
      "additionalProperties": false,
      "required": ["status", "sha", "run_url", "checks"],
      "properties": {
        "status": { "enum": ["open", "local-pass", "pass", "failed"] },
        "sha": { "$ref": "#/$defs/sha" },
        "run_url": { "$ref": "#/$defs/uriOrEmpty" },
        "checks": { "type": "array", "items": { "type": "string", "minLength": 1 } }
      }
    },
    "platformArtifact": {
      "type": "object",
      "additionalProperties": false,
      "required": ["status", "artifact_url", "sha256", "updater_signature_url", "updater_signature_verified", "code_signature_status", "code_signer", "code_signature_evidence_url", "sbom_url", "sbom_sha256", "provenance_url", "provenance_verified"],
      "properties": {
        "status": { "enum": ["open", "pass", "failed"] },
        "artifact_url": { "$ref": "#/$defs/uriOrEmpty" },
        "sha256": { "type": "string", "pattern": "^([0-9a-f]{64})?$" },
        "updater_signature_url": { "$ref": "#/$defs/uriOrEmpty" },
        "updater_signature_verified": { "type": "boolean" },
        "code_signature_status": { "enum": ["open", "pass", "failed", "not_applicable"] },
        "code_signer": { "type": "string" },
        "code_signature_evidence_url": { "$ref": "#/$defs/uriOrEmpty" },
        "sbom_url": { "$ref": "#/$defs/uriOrEmpty" },
        "sbom_sha256": { "type": "string", "pattern": "^([0-9a-f]{64})?$" },
        "provenance_url": { "$ref": "#/$defs/uriOrEmpty" },
        "provenance_verified": { "type": "boolean" }
      }
    },
    "artifacts": {
      "type": "object",
      "additionalProperties": false,
      "required": ["status", "platforms"],
      "properties": {
        "status": { "enum": ["open", "pass", "failed"] },
        "platforms": {
          "type": "object",
          "additionalProperties": false,
          "required": ["macos_arm64", "macos_x64", "windows_x64", "windows_arm64", "linux_x64"],
          "properties": {
            "macos_arm64": { "$ref": "#/$defs/platformArtifact" },
            "macos_x64": { "$ref": "#/$defs/platformArtifact" },
            "windows_x64": { "$ref": "#/$defs/platformArtifact" },
            "windows_arm64": { "$ref": "#/$defs/platformArtifact" },
            "linux_x64": { "$ref": "#/$defs/platformArtifact" }
          }
        }
      }
    },
    "governance": {
      "type": "object",
      "additionalProperties": false,
      "required": ["status", "release_pin", "legal_owner", "dpo_owner", "independent_judge", "decision", "evidence_url", "evidence_sha256"],
      "properties": {
        "status": { "enum": ["open", "pass", "failed"] },
        "release_pin": { "type": "string", "minLength": 1 },
        "legal_owner": { "type": "string" },
        "dpo_owner": { "type": "string" },
        "independent_judge": { "type": "string" },
        "decision": { "enum": ["open", "approved", "rejected"] },
        "evidence_url": { "$ref": "#/$defs/uriOrEmpty" },
        "evidence_sha256": { "type": "string", "pattern": "^([0-9a-f]{64})?$" }
      }
    },
    "operations": {
      "type": "object",
      "additionalProperties": false,
      "required": ["status", "release_pin", "environment", "operator", "independent_judge", "started_at", "completed_at", "deployed", "health_verified", "recovery_verified", "rollback_verified", "evidence_url", "evidence_sha256"],
      "properties": {
        "status": { "enum": ["open", "pass", "failed"] },
        "release_pin": { "type": "string", "minLength": 1 },
        "environment": { "type": "string" },
        "operator": { "type": "string" },
        "independent_judge": { "type": "string" },
        "started_at": { "type": "string" },
        "completed_at": { "type": "string" },
        "deployed": { "type": "boolean" },
        "health_verified": { "type": "boolean" },
        "recovery_verified": { "type": "boolean" },
        "rollback_verified": { "type": "boolean" },
        "evidence_url": { "$ref": "#/$defs/uriOrEmpty" },
        "evidence_sha256": { "type": "string", "pattern": "^([0-9a-f]{64})?$" }
      }
    },
    "approval": {
      "type": "object",
      "additionalProperties": false,
      "required": ["name", "evidence_url", "evidence_sha256"],
      "properties": {
        "name": { "type": "string" },
        "evidence_url": { "$ref": "#/$defs/uriOrEmpty" },
        "evidence_sha256": { "type": "string", "pattern": "^([0-9a-f]{64})?$" }
      }
    },
    "approvals": {
      "type": "object",
      "additionalProperties": false,
      "required": ["product", "security", "legal"],
      "properties": {
        "product": { "$ref": "#/$defs/approval" },
        "security": { "$ref": "#/$defs/approval" },
        "legal": { "$ref": "#/$defs/approval" }
      }
    },
    "supersession": {
      "type": "object",
      "additionalProperties": false,
      "required": ["superseded_at", "superseded_by_source_sha", "reason"],
      "properties": {
        "superseded_at": { "type": "string", "format": "date-time" },
        "superseded_by_source_sha": { "$ref": "#/$defs/sha" },
        "reason": { "type": "string", "minLength": 1 }
      }
    },
    "blocker": {
      "type": "object",
      "additionalProperties": false,
      "required": ["id", "owner", "resolution", "evidence_required"],
      "properties": {
        "id": { "type": "string", "minLength": 1 },
        "owner": { "type": "string", "minLength": 1 },
        "resolution": { "type": "string", "minLength": 1 },
        "evidence_required": { "type": "string", "minLength": 1 }
      }
    }
  }
}
